RT BREAKING Deutsche Bank giving Trump financial records Congress ,RT p lengths William Barr Trump McConnell et al go order prevent release report ,RT Betsy DeVos cutting funding Special Olympics We make difficult decisions The Special Olympics c ,RT BREAKING Deutsche Bank agreed turn Trump financial records Congress 
RT Dear Surya Modi Tughlaq Raj Karnataka lost 9000 cr due centre injustice 15th FC BLR Suburban Ra ,RT Prime Minister Narendra Modi Rahul Gandhi makes intervention speech Lok Sabha I speaking last 30 4 ,RT Watch till End PM Modi Bahut Se Tubelight ke saath aise hee hota hai amp congress MP sitting next Rahul Gan ,RT Modi terrorist Stop violence KashmirViaKhalistan ,RT I heard Opposition MP saying beat Modi sticks 6 months I also decided Surya Namaskar ,RT Modi ji need IT cell He roast opposition better anyone ,Rahul Gandhi scurries cover PM Modi employs gift gab expose hypocrisy ,RT We told Quit India slogan given Muslims India This problem opposition minds ,RT Modi ji need IT cell He roast opposition better anyone ,Democracy good gave people like modi chance become PM Save 
RT Dear Surya Modi Tughlaq Raj Karnataka lost 9000 cr due centre injustice 15th FC BLR Suburban Ra ,RT Prime Minister Narendra Modi Rahul Gandhi makes intervention speech Lok Sabha I speaking last 30 4 ,RT Watch till End PM Modi Bahut Se Tubelight ke saath aise hee hota hai amp congress MP sitting next Rahul Gan ,RT Modi terrorist Stop violence KashmirViaKhalistan ,RT I heard Opposition MP saying beat Modi sticks 6 months I also decided Surya Namaskar ,RT Modi ji need IT cell He roast opposition better anyone ,Rahul Gandhi scurries cover PM Modi employs gift gab expose hypocrisy ,RT We told Quit India slogan given Muslims India This problem opposition minds ,RT Modi ji need IT cell He roast opposition better anyone ,Democracy good gave people like modi chance become PM Save ,RT Even I understood CAA affect Muslims India friends Germany also Then India ,RT Sources 10JP told Congress supporters happy PM Modi bashed Rahul Gandhi LokSabha Supporter ,aswani Modi history running away interviews cuz face truth Or coward ,Thanks Modi born 1950 19 20 Bacha Khan Ahmedabad This would make ,RT Any gusses Tubelight PM Modi means Tubelight ,RT I heard Opposition MP saying beat Modi sticks 6 months I also decided Surya Namaskar ,RT WATCH Prime Minister Narendra Modi Rahul Gandhi made intervention speech Lok Sabha I speaking las ,RT Ethnofascist Ghani banned Kashmir Day celebration Kabul famous Intercontinental Hotel prove loyalty barbaric ,says one plagiarised speech Washington monthly replaced word Trump Modi ,New post Sena Takes Dig Modi Over Ram Temple Trust Announcement Before Delhi Polls 

RT WORLD There many great books But like naishtam book ramgopalvarma RGVWORLD ,RT Find influenced filmmakers RGV RamGopalVarma RajandDK htt ,Find influenced filmmakers RGV RamGopalVarma RajandDK ,RT WORLD There many great books But like naishtam book ramgopalvarma RGVWORLD ,There many great books But like naishtam book ramgopalvarma RGVWORLD ,RT ronit First time I seeing RamGopalVarma RGV emotional This shows real inner character The ,First time I seeing RamGopalVarma RGV emotional This shows real inner charact ,RT RamGopalVarma criticised directorial ventures recent years But revolutionary impact Hindi cinema ,RT RamGopalVarma criticised directorial ventures recent years But revolutionary impact Hindi cinema ,RT In two seconds RamGopalVarma gave title ,RT RamGopalVarma criticised directorial ventures recent years But revolutionary impact Hindi cinema ,Was blown away Ram Gopal Varma generosity giving us Get news featured u ,RT RamGopalVarma criticised directorial ventures recent years But revolutionary impact Hindi cinema ,RT In two seconds RamGopalVarma gave title ,RT In two seconds RamGopalVarma gave title ,In two seconds RamGopalVarma gave title ,RT RamGopalVarma criticised directorial ventures recent years But revolutionary impact Hindi cinema ,RT RamGopalVarma criticised directorial ventures recent years But revolutionary impact Hindi cinema ,RT RamGopalVarma criticised directorial ventures recent years But revolutionary impact Hindi cinema ,RT RamGopalVarma criticised directorial ventures recent years But revolutionary impact Hindi cinema 
RT singh Every time Rahul Gandhi makes political speech reminds us Modi second term ,RT Kashmir identity turned bombs guns separatism Some people say Kashmir lost identity ha ,RT Modi henchman message 200 million muslims country ,RT Narendra Modi parliament cameras firmly fixed speaking 100 minutes one really position th ,RT I heard Opposition MP saying beat Modi sticks 6 months I also decided Surya Namaskar 
RT Jashn e Ekta ShaheenBagh everyday YehHaiIndia ,RT When dir met complete script hand He gist plot ready writte ,RT Best comedy Akshay kumar SRK cameo ,RT pirate STAR RANKING January 2020 1 SalmanKhan 1894 2 AkshayKumar 895 3 RanbirKapoor 891 4 TigerShroff 65 ,RT BOI STAR RANKING January 2020 1 SalmanKhan 1894 2 AkshayKumar 895 3 RanbirKapoor 891 4 TigerShroff 
RT Facts INFO Taehyung Chinese Fanbase Vbar donated 50 000 surgical mask 20 000 KN 95 Anti pollution Mask goggles operating suit ,RT The coronavirus death toll mainland China jumped 73 563 10 people quarantined cruise liner Japan te ,I literally wondered Tesla China going Corona virus ,RT The PM father Stanley Johnson met Chinese ambassador Liu Xiaoming emailed worries UK officials accidenta ,RT The cost China cover The fateful consequence official silence facilitated exodus ,RT Things meaningless truth presidential Separation Church amp State impeachment Constitution Presidentia ,RT Taiwan says China feeding WHO wrong information virus cases island ,RT Frontline healthcare workers risk LIFE LIMB EVERYDAY keyboard know alls presume enough pr ,RT I seen videos disgusting I believe Chinese people eat EVERYTHING mo ,RT 2020 One latest statistics As see recover reported cases Deaths stop rising Thi 
RT What happen 1 BJP ads Newspapers violating MCC 2 Modi speech TV day 3 Accusation ,RT Pakistan Students trapped China sought help Prime Minister Modi video He raised slogan ,RT I heard Opposition MP saying beat Modi sticks 6 months I also decided Surya Namaskar ,RT In current situation India Pakistan worried first time Hindu intellectual ,RT If opposition leaders must learn anything last months The Shah Modi Kashmir Assam models ,RT Modi huge complex Nehru Multiple term CM two term PM peddles lies predecessor Parliament ,RT The actions Modi arrogance achieved winning elections campaign based hate amp ext ,RT Modi inflicting pain Mehbooba Mufti Omar Abdullah security reason give Hindutva Ga ,RT PM Modi laughter moments Loksabha DelhiWithBJP PMinLokShabha 45 Tubelight BJP45PlusInDelhi PM ,RT Nothing wrong ambition Prime Minister But time 1 person ambition PM 
RT The cost SPG protection PM Modi 584 crore year The cost PM Modi foreign travels since 2014 2021 crore ,RT RT If You Love The Speech Of PM Modi Ji CONgress Insults Savarkar ,RT This real problem India economy Modi war black money met resentment rich ,Me What Are NRC CAB How Know I Nationalist BJP System Worry Not BJP System Aadhaar Pan Card Ras ,RT Javed Akhtar called Narendra Modi fascist latest attack Prime Minister 
RT News No 3 Our Sid Get Support Of A Legend Of Bollywood Industry Shree Amitabh Ji He Started Following Sid On Twitte ,RT brk Brahmastra film excites 2020 It fantasy genre mythological StarCast amp course SRK Cameo makes ,RT So according sir first release Zero film reveal name may ,RT Army I seeing many SRKians genuinely congratulating Akki Dhoom4 tho rumour confirmed yet nd apprec ,RT brk Brahmastra film excites 2020 It fantasy genre mythological StarCast amp course SRK Cameo makes ,RT handle sunggyu looking smile ,It trend ,RT Our favorite Banana Splitter vs Big Boss Who win Decentraland one 20 Big Bosses l ,RT rao The way SiddharthShukla stopped ShehnaazGill hugging Arti reminded kuch kuch hota hai scene srk He kn ,RT Omg finally awaited JV loved CHAMP SidharthShukla Bigg Boss ha 
RT Stop watch video amp read happening India As Trump Modi parade across cou ,RT Stop watch video amp read happening India As Trump Modi parade across cou ,RT What Modi What Modi promised Delivered ,RT On subject oppressive leaders blood hands resoundingly criticized rather praised ,RT Dave Arun Mishra J fawning praise Modi The judiciary fast eroding hopes amp aspirations great people ,RT From 2 9 million member We Support Narendra Modi group Facebook 19 minutes ago ,This poison going people heads time soon Modi might temporary symbol hate dam ,RT Here piece last night India Prime Minister Narendra Modi ,RT In 1992 Babri Masjid destroyed RSS goons Ayodhya Modi sanghis 2020 rampage capital ,RT Bjp amp Modi fast track hate monger Kapil Mishra RS He male version looney terror accused Bjp MP Sadh 
RT George Miller Mad Max Furiosa release June 23 2023 The prequel film stars Anya Taylor Joy Chris Hemsworth ,Hard argue I would also think someone like Yahya Abdul Mateen II seen bl ,RT George Miller Mad Max Furiosa release June 23 2023 The prequel film stars Anya Taylor Joy Chris Hemsworth ,Aujourd hui il fallait reconnaitre Spencer Haywood 1971 1975 Dennis Johnson 1977 1980 Tom Chambers 198 ,RT names Abdul Mateen II one BreakthroughEntertainers 2020 The 34 year old actor stars Watchm 
RT George Miller Mad Max Furiosa release June 23 2023 The prequel film stars Anya Taylor Joy Chris Hemsworth ,Hard argue I would also think someone like Yahya Abdul Mateen II seen bl ,RT George Miller Mad Max Furiosa release June 23 2023 The prequel film stars Anya Taylor Joy Chris Hemsworth ,Aujourd hui il fallait reconnaitre Spencer Haywood 1971 1975 Dennis Johnson 1977 1980 Tom Chambers 198 ,RT names Abdul Mateen II one BreakthroughEntertainers 2020 The 34 year old actor stars Watchm ,RT The beauty Makkah ,RT Merry Christmas twt ,RT For least today I hope white flowers come hearts feel even little bit warm comfor ,Wishing amp family wonderful Merry Christmas amp happy holiday xmas merrychristmas christmaseve ,OMG Im okay Happy Holidays twt ThankYouBTS SnowfFowerbyV TAEHYUNG JIMIN 
RT George Miller Mad Max Furiosa release June 23 2023 The prequel film stars Anya Taylor Joy Chris Hemsworth ,Hard argue I would also think someone like Yahya Abdul Mateen II seen bl ,RT George Miller Mad Max Furiosa release June 23 2023 The prequel film stars Anya Taylor Joy Chris Hemsworth ,Aujourd hui il fallait reconnaitre Spencer Haywood 1971 1975 Dennis Johnson 1977 1980 Tom Chambers 198 ,RT names Abdul Mateen II one BreakthroughEntertainers 2020 The 34 year old actor stars Watchm ,RT The beauty Makkah ,RT Merry Christmas twt ,RT For least today I hope white flowers come hearts feel even little bit warm comfor ,Wishing amp family wonderful Merry Christmas amp happy holiday xmas merrychristmas christmaseve ,OMG Im okay Happy Holidays twt ThankYouBTS SnowfFowerbyV TAEHYUNG JIMIN ,RT Trending On No 5 Boost Trend Let make SalmanKhan position 3DAYS TO SALMANs BDAY ,RT SalmanKhan spends 10 total income rest donates charities A part ,RT SalmanKhan spends 10 total income rest donates charities A part ,RT SalmanKhan spends 10 total income rest donates charities A part ,RT SalmanKhan spends 10 total income rest donates charities A part 
nightingail I may know personally I wish genuine happiness Looking forward growth You ,RT Delhi govt may eased home delivery whiskey happiness like dog Adopt Whiskey AdoptDontShop ,Congrats I wish nothing happiness shedding toxicity embarking next chapter life ,RT BTS Motto ARMY answer Give us stage Let Seven soon one Your happiness ,RT Join celebrating OUR HAPPINESS TAEHYUNG globally beloVed 8 years infinity Share unique journey w ,bryce wins genuinely cry w tears happiness deserves much especially soo many people doubting ,RT know needs hear okay okay kind amp refuse let negative feelings trig ,RT TRANS j hope festa Name J Hobby Affiliation So bright Career Grammy performer BTS Dance Team Leader ,RT If reason love means love changes reason gone I loved without reason Ki ,RT 8 years happiness taehyung beautiful day celebrate im thankful I know would ,RT hey guys didnt want say think im gon na deactivating soon thank happiness friends mem ,RT want jimin happy award v would like give jimin smile laugh smi ,aaaaaa happiness birthday mistyy ,RT When meet OUR HAPPINESS TAEHYUNG Share story templates made ,Something makes happy There things elicit feeling true happiness due f ,RT happiness happiness ,If guess right trying search happiness attention left Im sayi ,Wealth Happiness Funds ,RT June filled love June filled prosperity June filled happiness June fil ,RT n therapy bts happiness ,RT tres OUR HAPPINESS TAEHYUNG 8YearsWithTaehyung twt ,RT Happiness around people may real family love support anyway ,RT happiness looks beautiful sanhwa ,RT Develop thick skin It high ROI terms mental peace happiness ,RT happiness taehyung 8YearsWithTaehyung ,RT source happiness tysm coming life u deserve world much ilusm lt 3 hope u know ,RT If reason love means love changes reason gone I loved without reason Ki ,Happiness Progress Money ,RT happiness taehyung 8YearsWithTaehyung ,RT Do plan achieve happiness drive away distress You never successful Simply surrender unto Me https ,RT Wishing cinematic genius ManiRatnam sir happy birthday Good health happiness always ,I love much Send love happiness ,RT happiness taehyung 8YearsWithTaehyung ,RT princee It endearing see members reaction jikook singing moment happiness looking h ,RT If something change 8 years Taehyung beautiful genuine smile never ,RT think might favorite screenshot cr ever taken lmao pure happiness top row vs shock ,RT Happy birthday SinB Wishing great health happiness best luck future endeavors ,RT thank comfort happiness give never get tired loving special love ,RT tosty Awwww mera baby gill u r truly definition love n happiness Gud nyt bubb ShehnaazGill Shehnaazians ,RT Purple last color rainbow means I trust love long time Kim Taehyung ,RT The Dubai 2040 Urban Master Plan introduces new era seeks enrich community happiness quality life spo ,RT I found happiness u ,RT I understand seokjin goal let cry bcs always wish happiness us ,flex wealth happiness ,RT happiness happiness ,RT 613 motto rm army answer sg give stages jin let jh seven one jm happiness happiness ,RT najab First day June I praying peace abundance amp happiness month ,RT want jimin happy award v would like give jimin smile laugh smi ,RT want jimin happy award v would like give jimin smile laugh smi ,RT June filled happiness June filled positivity June filled kindness June b ,lilrookie If brings happiness joy often shitty world much right ,RT Vote Taehyung Social Media Leader poll let keep lead widen gap OUR HAPPI ,RT Facts When BTS debuted Taehyung shy hid face hands front cameras entering building Lo ,RT happiness happiness ,RT June filled happiness June filled positivity June filled kindness June b ,RT n twt happiness happiness ,RT Can believe 8 years since Taehyung revealed final member BTS 8YearsWithTaehyung OUR HAP ,RT Buzz This clip summarises pure beautiful Taehyung No words needed OUR HAPPINESS TAEHYUNG 8YearsWithTaehyung ,RT monk We take wisdom Bhagavad Gita understand happiness really Love Godhead means happiness ,RT true happiness looks like ,RT want jimin happy award v would like give jimin smile laugh smi ,RT trio radiates pure happiness ,RT n therapy bts happiness ,RT 8YearsWithTaehyung OUR HAPPINESS TAEHYUNG thank sweet taetae borahae ,RT may June filled healing immeasurable happiness ,RT Happiness ,RT Purple last color rainbow means I trust love long time Kim Taehyung ,RT Kabir put stones forehead happiness let name go heart Those ,RT dreamer My favorite moment today episode kiss moment Shaurya clapped wife became ,RT OUR HAPPINESS TAEHYUNG 8YearsWithTaehyung BTS twt ,RT najab First day June I praying peace abundance amp happiness month ,RT 613 motto rm army answer sg give stages jin let jh seven one jm happiness happiness ,RT jaatni God Kabir said Dukh mein sumiran sab karein sukh mein kare na koi Jo sukh mein sum ,RT TRENDS OUR HAPPINESS TAEHYUNG entered top 5 Worldwide Trends 8YearsWithTaehyung ,RT 613 motto rm army answer sg give stages jin let jh seven one jm happiness happiness ,RT doctor 1 Make peace past 2 No one charge happiness 3 Time heals almost everything 4 S ,RT UNION OUR HAPPINESS TAEHYUNG formally introduced world 19 year old boy Western features charge ,RT God Kabir said Dukh mein sumiran sab karein sukh mein kare na koi Jo sukh mein sum ,explains extra happiness ,The last past two years great horrible I hope rest year brings peace happiness ,RT najab First day June I praying peace abundance amp happiness month ,RT happiness butterfly lana del rey ,RT 613 motto rm army answer sg give stages jin let jh seven one jm happiness happiness ,RT india Google Search BTS V Butter seems trending topic since yesterday unforgettable moment BTS V also ,RT Did know Taehyung reads first letter fan That love us started 8 ye ,RT 8 years since taehyung revealed final member bts grown well brought much ,RT PAGE 2 BTS motto ARMYs answer Give us stage Let Seven one Your happiness ,RT almost This day month ago I felt genuine happiness relief years 2nd May hope darke ,Mam know follows please send I link follows ,RT Buzz This clip summarises pure beautiful Taehyung No words needed OUR HAPPINESS TAEHYUNG 8YearsWithTaehyung ,RT Be happy Be wan na If others like let Happiness choice Life pleasing everyb ,RT 8YearsWithTaehyung OUR HAPPINESS TAEHYUNG thank sweet taetae borahae ,RT special thanks wings ARMY special thanks happiness ARMY special thanks universe ARMY special thanks ,RT happiness taehyung 8YearsWithTaehyung ,RT n therapy bts happiness ,8YearsWithTaehyung OUR HAPPINESS TAEHYUNG ,RT 613 motto rm army answer sg give stages jin let jh seven one jm happiness happiness ,RT 613 motto rm army answer sg give stages jin let jh seven one jm happiness happiness ,RT Day 26 Meaning Haechan life He happiness HAECHAN NCT 30Days Haechan challenge 30 ,RT true happiness looks like 
nightingail I may know personally I wish genuine happiness Looking forward growth You ,RT Delhi govt may eased home delivery whiskey happiness like dog Adopt Whiskey AdoptDontShop ,Congrats I wish nothing happiness shedding toxicity embarking next chapter life ,RT BTS Motto ARMY answer Give us stage Let Seven soon one Your happiness ,RT Join celebrating OUR HAPPINESS TAEHYUNG globally beloVed 8 years infinity Share unique journey w ,bryce wins genuinely cry w tears happiness deserves much especially soo many people doubting ,RT know needs hear okay okay kind amp refuse let negative feelings trig ,RT TRANS j hope festa Name J Hobby Affiliation So bright Career Grammy performer BTS Dance Team Leader ,RT If reason love means love changes reason gone I loved without reason Ki ,RT 8 years happiness taehyung beautiful day celebrate im thankful I know would ,RT hey guys didnt want say think im gon na deactivating soon thank happiness friends mem ,RT want jimin happy award v would like give jimin smile laugh smi ,aaaaaa happiness birthday mistyy ,RT When meet OUR HAPPINESS TAEHYUNG Share story templates made ,Something makes happy There things elicit feeling true happiness due f ,RT happiness happiness ,If guess right trying search happiness attention left Im sayi ,Wealth Happiness Funds ,RT June filled love June filled prosperity June filled happiness June fil ,RT n therapy bts happiness ,RT tres OUR HAPPINESS TAEHYUNG 8YearsWithTaehyung twt ,RT Happiness around people may real family love support anyway ,RT happiness looks beautiful sanhwa ,RT Develop thick skin It high ROI terms mental peace happiness ,RT happiness taehyung 8YearsWithTaehyung ,RT source happiness tysm coming life u deserve world much ilusm lt 3 hope u know ,RT If reason love means love changes reason gone I loved without reason Ki ,Happiness Progress Money ,RT happiness taehyung 8YearsWithTaehyung ,RT Do plan achieve happiness drive away distress You never successful Simply surrender unto Me https ,RT Wishing cinematic genius ManiRatnam sir happy birthday Good health happiness always ,I love much Send love happiness ,RT happiness taehyung 8YearsWithTaehyung ,RT princee It endearing see members reaction jikook singing moment happiness looking h ,RT If something change 8 years Taehyung beautiful genuine smile never ,RT think might favorite screenshot cr ever taken lmao pure happiness top row vs shock ,RT Happy birthday SinB Wishing great health happiness best luck future endeavors ,RT thank comfort happiness give never get tired loving special love ,RT tosty Awwww mera baby gill u r truly definition love n happiness Gud nyt bubb ShehnaazGill Shehnaazians ,RT Purple last color rainbow means I trust love long time Kim Taehyung ,RT The Dubai 2040 Urban Master Plan introduces new era seeks enrich community happiness quality life spo ,RT I found happiness u ,RT I understand seokjin goal let cry bcs always wish happiness us ,flex wealth happiness ,RT happiness happiness ,RT 613 motto rm army answer sg give stages jin let jh seven one jm happiness happiness ,RT najab First day June I praying peace abundance amp happiness month ,RT want jimin happy award v would like give jimin smile laugh smi ,RT want jimin happy award v would like give jimin smile laugh smi ,RT June filled happiness June filled positivity June filled kindness June b ,lilrookie If brings happiness joy often shitty world much right ,RT Vote Taehyung Social Media Leader poll let keep lead widen gap OUR HAPPI ,RT Facts When BTS debuted Taehyung shy hid face hands front cameras entering building Lo ,RT happiness happiness ,RT June filled happiness June filled positivity June filled kindness June b ,RT n twt happiness happiness ,RT Can believe 8 years since Taehyung revealed final member BTS 8YearsWithTaehyung OUR HAP ,RT Buzz This clip summarises pure beautiful Taehyung No words needed OUR HAPPINESS TAEHYUNG 8YearsWithTaehyung ,RT monk We take wisdom Bhagavad Gita understand happiness really Love Godhead means happiness ,RT true happiness looks like ,RT want jimin happy award v would like give jimin smile laugh smi ,RT trio radiates pure happiness ,RT n therapy bts happiness ,RT 8YearsWithTaehyung OUR HAPPINESS TAEHYUNG thank sweet taetae borahae ,RT may June filled healing immeasurable happiness ,RT Happiness ,RT Purple last color rainbow means I trust love long time Kim Taehyung ,RT Kabir put stones forehead happiness let name go heart Those ,RT dreamer My favorite moment today episode kiss moment Shaurya clapped wife became ,RT OUR HAPPINESS TAEHYUNG 8YearsWithTaehyung BTS twt ,RT najab First day June I praying peace abundance amp happiness month ,RT 613 motto rm army answer sg give stages jin let jh seven one jm happiness happiness ,RT jaatni God Kabir said Dukh mein sumiran sab karein sukh mein kare na koi Jo sukh mein sum ,RT TRENDS OUR HAPPINESS TAEHYUNG entered top 5 Worldwide Trends 8YearsWithTaehyung ,RT 613 motto rm army answer sg give stages jin let jh seven one jm happiness happiness ,RT doctor 1 Make peace past 2 No one charge happiness 3 Time heals almost everything 4 S ,RT UNION OUR HAPPINESS TAEHYUNG formally introduced world 19 year old boy Western features charge ,RT God Kabir said Dukh mein sumiran sab karein sukh mein kare na koi Jo sukh mein sum ,explains extra happiness ,The last past two years great horrible I hope rest year brings peace happiness ,RT najab First day June I praying peace abundance amp happiness month ,RT happiness butterfly lana del rey ,RT 613 motto rm army answer sg give stages jin let jh seven one jm happiness happiness ,RT india Google Search BTS V Butter seems trending topic since yesterday unforgettable moment BTS V also ,RT Did know Taehyung reads first letter fan That love us started 8 ye ,RT 8 years since taehyung revealed final member bts grown well brought much ,RT PAGE 2 BTS motto ARMYs answer Give us stage Let Seven one Your happiness ,RT almost This day month ago I felt genuine happiness relief years 2nd May hope darke ,Mam know follows please send I link follows ,RT Buzz This clip summarises pure beautiful Taehyung No words needed OUR HAPPINESS TAEHYUNG 8YearsWithTaehyung ,RT Be happy Be wan na If others like let Happiness choice Life pleasing everyb ,RT 8YearsWithTaehyung OUR HAPPINESS TAEHYUNG thank sweet taetae borahae ,RT special thanks wings ARMY special thanks happiness ARMY special thanks universe ARMY special thanks ,RT happiness taehyung 8YearsWithTaehyung ,RT n therapy bts happiness ,8YearsWithTaehyung OUR HAPPINESS TAEHYUNG ,RT 613 motto rm army answer sg give stages jin let jh seven one jm happiness happiness ,RT 613 motto rm army answer sg give stages jin let jh seven one jm happiness happiness ,RT Day 26 Meaning Haechan life He happiness HAECHAN NCT 30Days Haechan challenge 30 ,RT true happiness looks like ,RT I Happy hurting healing time ask ,Let us help guys Looking 46 Malaysians And 90 time review ,RT One87 I AIA Life Planner Feel free DM ask Family protection Medical Card Hibah Stay safe KitaJagaKita ,tak sure kalau hibah suggest takaful ,RT Hi I officially Life Planner AIA Public Takaful Berhad If guys ada questions regarding Medical Card ,RT Hi I officially Life Planner AIA Public Takaful Berhad If guys ada questions regarding Medical Card ,Hi everyone yang still tengah mencari best public takaful plan let us help obtainin ,Hibah auto increase RM50 000 every 5 years ,If guys anything ask regarding Takaful Hibah Medical Card Income Protection hesitate ,Congratulations Hibah So happy 
